<?xml version="1.0" encoding="UTF-8"?>
<xs:schema attributeFormDefault="unqualified" elementFormDefault="qualified" xmlns:xs="http://www.w3.org/2001/XMLSchema">
  <xs:element name="config" type="configType"/>
  <xs:complexType name="unitType">
    <xs:sequence>
      <xs:element type="convertType" name="convert"/>
    </xs:sequence>
    <xs:attribute type="xs:string" name="code" use="required"/>
    <xs:attribute type="xs:string" name="symbol" use="required"/>
    <xs:attribute type="xs:string" name="name" use="required"/>
    <xs:attribute type="xs:int" name="sortOrder" use="required"/>
  </xs:complexType>
  <xs:complexType name="familyType">
    <xs:sequence>
      <xs:element type="unitType" name="unit" maxOccurs="unbounded" minOccurs="1"/>
    </xs:sequence>
    <xs:attribute type="xs:string" name="code" use="required"/>
    <xs:attribute type="xs:string" name="name" use="required"/>
    <xs:attribute type="xs:string" name="standard" use="required"/>
    <xs:attribute type="xs:int" name="sortOrder" use="required"/>
  </xs:complexType>
  <xs:complexType name="convertType">
    <xs:sequence>
      <xs:element type="strategyType" name="strategy" maxOccurs="unbounded" minOccurs="1"/>
    </xs:sequence>
  </xs:complexType>
  <xs:complexType name="configType">
    <xs:sequence>
      <xs:element type="familyType" name="family" maxOccurs="unbounded" minOccurs="1"/>
    </xs:sequence>
  </xs:complexType>
  <xs:complexType name="strategyType">
    <xs:simpleContent>
      <xs:extension base="xs:string">
        <xs:attribute type="xs:string" name="name" use="required"/>
        <xs:attribute type="xs:float" name="value" use="required"/>
      </xs:extension>
    </xs:simpleContent>
  </xs:complexType>
</xs:schema>